<?xml version='1.0' encoding='UTF-8'?>
<rutas xmlns="http://www.uniovi.es" xmlns:xsi="http://www.w3.org/2001/XMLSchema-instance" xsi:schemaLocation="http://www.uniovi.es rutas.xsd">

    <ruta>
        <nombre>Casco histórico de Burgos</nombre>
        <tipo>Arquitectura y monumentos</tipo>
        <medioTransporte>A pie</medioTransporte>
        <fechaInicio>2026-04-12</fechaInicio>
        <horaInicio>10:00:00</horaInicio>
        <duracion>4 horas</duracion>
        <agencia>Sin agencia</agencia>
        <descripcion>Recorrido a pie por el conjunto monumental de la ciudad de Burgos, declarada Patrimonio de la Humanidad. Partiendo del Museo de la Evolución Humana, la ruta sigue el Paseo del Espolón, cruza el Arco de Santa María y termina en la Catedral, recorriendo más de mil años de historia castellana.</descripcion>
        <personasAdecuadas>Apta para todos los públicos, incluidas familias con niños</personasAdecuadas>
        <lugarInicio>Museo de la Evolución Humana</lugarInicio>
        <direccionInicio>Paseo Sierra de Atapuerca, s/n - 09002 Burgos</direccionInicio>
        <coordenadasInicio>
            <long>-3.697144</long>
            <lat>42.339372</lat>
            <altitud unidad="metros">858</altitud>
        </coordenadasInicio>
        <bibliografia>
            <referencia alt="Turismo de Burgos">https://www.turismoburgos.org/</referencia>
            <referencia alt="Catedral de Burgos en Wikipedia">https://es.wikipedia.org/wiki/Catedral_de_Burgos</referencia>
            <referencia alt="Museo de la Evolución Humana">https://www.museoevolucionhumana.com/</referencia>
        </bibliografia>
        <recomendacion>9</recomendacion>
        <hitos>
            <hito>
                <nombre>Museo de la Evolución Humana</nombre>
                <descripcion>Museo dedicado a la evolución humana y a los hallazgos paleontológicos de los yacimientos de la Sierra de Atapuerca, Patrimonio de la Humanidad. Diseñado por Juan Navarro Baldeweg, es una de las visitas imprescindibles de Burgos.</descripcion>
                <coordenadas>
                    <long>-3.697144</long>
                    <lat>42.339372</lat>
                    <altitud unidad="metros">858</altitud>
                </coordenadas>
                <distanciaAnterior unidad="metros">0</distanciaAnterior>
                <galeriaFotos>
                    <imagen urlf="../multimedia/meh_exterior.jpg" alt="Edificio del Museo de la Evolución Humana"/>
                    <imagen urlf="../multimedia/meh_interior.jpg" alt="Sala de exposiciones del museo"/>
                </galeriaFotos>
                <galeriaVideos>
                    <video urlv="../multimedia/meh_recorrido.mp4" alt="Recorrido por el museo"/>
                </galeriaVideos>
            </hito>
            <hito>
                <coordenadas>
                    <long>-3.697374</long>
                    <lat>42.339991</lat>
                    <altitud unidad="metros">859</altitud>
                </coordenadas>
                <distanciaAnterior unidad="metros">71</distanciaAnterior>
            </hito>
            <hito>
                <coordenadas>
                    <long>-3.699039</long>
                    <lat>42.339727</lat>
                    <altitud unidad="metros">856</altitud>
                </coordenadas>
                <distanciaAnterior unidad="metros">140</distanciaAnterior>
            </hito>
            <hito>
                <coordenadas>
                    <long>-3.699584</long>
                    <lat>42.340699</lat>
                    <altitud unidad="metros">862</altitud>
                </coordenadas>
                <distanciaAnterior unidad="metros">117</distanciaAnterior>
            </hito>
            <hito>
                <coordenadas>
                    <long>-3.699728</long>
                    <lat>42.340439</lat>
                    <altitud unidad="metros">862</altitud>
                </coordenadas>
                <distanciaAnterior unidad="metros">31</distanciaAnterior>
            </hito>
            <hito>
                <coordenadas>
                    <long>-3.701919</long>
                    <lat>42.339907</lat>
                    <altitud unidad="metros">862</altitud>
                </coordenadas>
                <distanciaAnterior unidad="metros">189</distanciaAnterior>
            </hito>
            <hito>
                <nombre>Paseo del Espolón</nombre>
                <descripcion>Paseo arbolado a orillas del río Arlanzón, corazón de la vida social burgalesa desde el siglo XVIII. Sus plátanos centenarios y el famoso quiosco de música lo convierten en uno de los lugares más emblemáticos de la ciudad.</descripcion>
                <coordenadas>
                    <long>-3.701979</long>
                    <lat>42.340151</lat>
                    <altitud unidad="metros">868</altitud>
                </coordenadas>
                <distanciaAnterior unidad="metros">28</distanciaAnterior>
                <galeriaFotos>
                    <imagen urlf="../multimedia/espolon.jpg" alt="Paseo del Espolón con sus plátanos centenarios"/>
                </galeriaFotos>
            </hito>
            <hito>
                <nombre>Arco de Santa María</nombre>
                <descripcion>Antigua puerta de la muralla medieval y entrada monumental al casco histórico de Burgos. Reconstruida en el siglo XVI a modo de retablo en honor al emperador Carlos V, alberga en su interior una sala de exposiciones.</descripcion>
                <coordenadas>
                    <long>-3.703819</long>
                    <lat>42.339765</lat>
                    <altitud unidad="metros">864</altitud>
                </coordenadas>
                <distanciaAnterior unidad="metros">157</distanciaAnterior>
                <galeriaFotos>
                    <imagen urlf="../multimedia/arco_santamaria.jpg" alt="Arco de Santa María iluminado"/>
                </galeriaFotos>
            </hito>
            <hito>
                <coordenadas>
                    <long>-3.704216</long>
                    <lat>42.340002</lat>
                    <altitud unidad="metros">874</altitud>
                </coordenadas>
                <distanciaAnterior unidad="metros">42</distanciaAnterior>
            </hito>
            <hito>
                <nombre>Plaza del Rey San Fernando</nombre>
                <descripcion>Plaza monumental en el corazón del casco histórico, situada frente a la fachada principal de la Catedral. Recibe su nombre en honor a Fernando III el Santo, rey castellano que ordenó iniciar la construcción de la Catedral en 1221.</descripcion>
                <coordenadas>
                    <long>-3.703939</long>
                    <lat>42.340349</lat>
                    <altitud unidad="metros">870</altitud>
                </coordenadas>
                <distanciaAnterior unidad="metros">45</distanciaAnterior>
                <galeriaFotos>
                    <imagen urlf="../multimedia/plaza_rey_fernando.jpg" alt="Plaza del Rey San Fernando con la Catedral al fondo"/>
                </galeriaFotos>
            </hito>
            <hito>
                <coordenadas>
                    <long>-3.704875</long>
                    <lat>42.339936</lat>
                    <altitud unidad="metros">863</altitud>
                </coordenadas>
                <distanciaAnterior unidad="metros">90</distanciaAnterior>
            </hito>
            <hito>
                <coordenadas>
                    <long>-3.705562</long>
                    <lat>42.339749</lat>
                    <altitud unidad="metros">871</altitud>
                </coordenadas>
                <distanciaAnterior unidad="metros">60</distanciaAnterior>
            </hito>
            <hito>
                <coordenadas>
                    <long>-3.705866</long>
                    <lat>42.339794</lat>
                    <altitud unidad="metros">872</altitud>
                </coordenadas>
                <distanciaAnterior unidad="metros">25</distanciaAnterior>
            </hito>
            <hito>
                <coordenadas>
                    <long>-3.705639</long>
                    <lat>42.339971</lat>
                    <altitud unidad="metros">871</altitud>
                </coordenadas>
                <distanciaAnterior unidad="metros">27</distanciaAnterior>
            </hito>
            <hito>
                <coordenadas>
                    <long>-3.705230</long>
                    <lat>42.340095</lat>
                    <altitud unidad="metros">882</altitud>
                </coordenadas>
                <distanciaAnterior unidad="metros">36</distanciaAnterior>
            </hito>
            <hito>
                <coordenadas>
                    <long>-3.705367</long>
                    <lat>42.340204</lat>
                    <altitud unidad="metros">882</altitud>
                </coordenadas>
                <distanciaAnterior unidad="metros">17</distanciaAnterior>
            </hito>
            <hito>
                <nombre>Iglesia de San Nicolás de Bari</nombre>
                <descripcion>Templo gótico del siglo XV famoso por su impresionante retablo mayor de piedra policromada, una de las obras maestras del gótico hispano. Situada en la calle Fernán González, junto a la Catedral.</descripcion>
                <coordenadas>
                    <long>-3.705511</long>
                    <lat>42.340544</lat>
                    <altitud unidad="metros">882</altitud>
                </coordenadas>
                <distanciaAnterior unidad="metros">40</distanciaAnterior>
                <galeriaFotos>
                    <imagen urlf="../multimedia/sannicolas.jpg" alt="Retablo de la iglesia de San Nicolás"/>
                </galeriaFotos>
            </hito>
            <hito>
                <coordenadas>
                    <long>-3.705414</long>
                    <lat>42.340573</lat>